{
  "schema_version": "rafaelia.f-next-continuous-evolution/v1",
  "chain_id": "F_NEXT_LEGAL_GNSS_20260826_V1",
  "recorded_at": "2026-08-26T21:00:00-03:00",
  "append_only": true,
  "claim_allowed": false,
  "risk_model_ref": "data/control-plane/omega-assurance/risk-vector.v1.json",
  "priority_contract_ref": "docs/canonical/2026-08-14/PERFORMANCE_METRIC_GAP_PRIORITY_CONTRACT_V1.md",
  "mother_invariants": [
    "IDEA != IMPLEMENTATION != EXECUTION != EVIDENCE != CLAIM",
    "urgency != permission_to_promote_evidence",
    "TOKEN_VAZIO != zero != false",
    "OS_PERMISSION != LAWFUL_BASIS",
    "precise_location != raw_GNSS_telemetry",
    "data_exists_on_device != data_reaches_service != data_reaches_AI",
    "contract_pass != physical_runtime_evidence",
    "claim_precision cannot exceed evidence precision"
  ],
  "claim_ladder": ["OBSERVATION","EVIDENCED_OBSERVATION","BOUNDED_CLAIM","PRECISE_CLAIM","GENERAL_CLAIM"],
  "stages": [
    {
      "id": "FN-GNSS-001",
      "order": 1,
      "state": "CLOSED_PASS",
      "priority": "P1",
      "urgency": "NOW",
      "scope": "contract and falsifiability boundary",
      "problem": "raw GNSS evidence previously lacked a typed receipt contract",
      "objective": "define the minimum authorized and minimized evidence envelope before any physical capture",
      "risk_vector": {"A":"CONTROLLED","S":"CONTROLLED","P":"CONTROLLED","G":"CONTROLLED","I":"CONTROLLED","V":"CONTROLLED","C":"CONTROLLED","U":"WATCH"},
      "provenance": ["schemas/GNSS_RUNTIME_RECEIPT_V1.schema.json","scripts/validate_gnss_runtime_receipt.py","data/receipts/legal/GLOBAL_DATA_PRIVACY_GNSS_AI_GOVERNANCE_RECEIPT_20260826_V4.json"],
      "required_evidence": ["schema present","validator self-test PASS","negative falsifiers PASS"],
      "falsifier": "validator accepts an unauthorized, non-minimized or malformed receipt",
      "closure_condition": "schema and fail-closed validator execute successfully in CI",
      "mitigations": ["require explicit authorization","require minimization","exclude unrelated personal data","keep claim_allowed false"],
      "forbidden_promotions": ["do not infer physical runtime from schema existence","do not infer service/model access from local capability"],
      "dependencies": [],
      "claim_target": "NONE",
      "next_on_pass": "FN-GNSS-002",
      "next_on_fail": "FN-GNSS-001"
    },
    {
      "id": "FN-GNSS-002",
      "order": 2,
      "state": "WAITING_EXTERNAL_RUNTIME",
      "priority": "P0",
      "urgency": "NOW",
      "scope": "one controlled physical Android GNSS capture",
      "problem": "no physical Android receipt proves which GNSS fields are actually exposed in the selected runtime",
      "objective": "capture one minimized local receipt on an authorized Android device without transmitting unrelated data",
      "risk_vector": {"A":"WATCH","S":"WATCH","P":"P1","G":"WATCH","I":"WATCH","V":"CONTROLLED","C":"CONTROLLED","U":"P1"},
      "provenance": ["schemas/GNSS_RUNTIME_RECEIPT_V1.schema.json","termux-api_rafcodephi/docs/PERMISSIONS.md"],
      "required_evidence": ["device/build identity","timestamp with timezone","permission state","location-service state","satellites visible/used when exposed","per-satellite fields only when exposed","accuracy/fix metadata when exposed","explicit TOKEN_VAZIO for unavailable fields","local receipt digest"],
      "falsifier": "capture cannot be tied to the declared device/runtime or contains fields not actually observed",
      "closure_condition": "one receipt validates and has immutable digest with no unrelated personal-data fields",
      "mitigations": ["local-only collection","minimum-duration sample","no contacts/SMS/call-log/microphone collection","redact exact coordinates from shared evidence unless necessary","store unavailable metrics as TOKEN_VAZIO"],
      "forbidden_promotions": ["no raw_GNSS_to_AI claim","no claim that every Android exposes the same fields","no legal-compliance claim from technical capture"],
      "dependencies": ["FN-GNSS-001"],
      "claim_target": "EVIDENCED_OBSERVATION",
      "next_on_pass": "FN-GNSS-003",
      "next_on_fail": "FN-GNSS-002"
    },
    {
      "id": "FN-GNSS-003",
      "order": 3,
      "state": "TOKEN_VAZIO",
      "priority": "P0",
      "urgency": "NEXT",
      "scope": "provenance and custody seal",
      "problem": "future runtime receipt must be independently tied to bytes, source revision and execution context",
      "objective": "seal the runtime observation with SHA-256, source commit, command/runtime identity and append-only custody",
      "risk_vector": {"A":"WATCH","S":"CONTROLLED","P":"WATCH","G":"WATCH","I":"P1","V":"CONTROLLED","C":"CONTROLLED","U":"P1"},
      "provenance": ["schemas/evidence-closure-record.v1.schema.json","docs/canonical/2026-08-14/PERFORMANCE_METRIC_GAP_PRIORITY_CONTRACT_V1.md"],
      "required_evidence": ["receipt SHA-256","source commit SHA","collector/version identity","execution command or app build identity","observed_at","previous-record link when revised"],
      "falsifier": "same claim resolves to unpinned or mutable evidence",
      "closure_condition": "provenance vector is complete enough to replay or independently inspect the evidence object",
      "mitigations": ["hash raw receipt","pin commit/build","append-only supersession instead of overwrite","preserve contradiction records"],
      "forbidden_promotions": ["no provenance completion by filename similarity","no substitution of parent/export hash for individual receipt hash"],
      "dependencies": ["FN-GNSS-002"],
      "claim_target": "EVIDENCED_OBSERVATION",
      "next_on_pass": "FN-GNSS-004",
      "next_on_fail": "FN-GNSS-003"
    },
    {
      "id": "FN-GNSS-004",
      "order": 4,
      "state": "TOKEN_VAZIO",
      "priority": "P0",
      "urgency": "NEXT",
      "scope": "boundary decomposition device -> OS -> app -> service/tool -> assistant/model",
      "problem": "device capability does not establish which downstream boundary receives each field",
      "objective": "test each boundary independently and preserve unknown boundaries instead of collapsing them",
      "risk_vector": {"A":"WATCH","S":"P1","P":"P1","G":"P1","I":"WATCH","V":"CONTROLLED","C":"WATCH","U":"P1"},
      "provenance": ["docs/legal/OPENAI_CHATGPT_LOCATION_BOUNDARY_20260826_V1.md","schemas/GNSS_RUNTIME_RECEIPT_V1.schema.json"],
      "required_evidence": ["boundary list","field-level allow/deny/unknown result per boundary","request/runtime identifiers when available","no-content proof for boundaries where only metadata is observable"],
      "falsifier": "a field claimed to cross a boundary is absent from the corresponding controlled evidence",
      "closure_condition": "every claimed boundary has direct evidence; every unobserved boundary remains TOKEN_VAZIO",
      "mitigations": ["test one boundary at a time","use synthetic/non-sensitive values where possible","do not expose exact coordinates unnecessarily","separate platform documentation from runtime evidence"],
      "forbidden_promotions": ["device field presence != service receipt","service receipt != model context","UI output != raw model input"],
      "dependencies": ["FN-GNSS-003"],
      "claim_target": "BOUNDED_CLAIM",
      "next_on_pass": "FN-GNSS-005",
      "next_on_fail": "FN-GNSS-004"
    },
    {
      "id": "FN-GNSS-005",
      "order": 5,
      "state": "TOKEN_VAZIO",
      "priority": "P1",
      "urgency": "NEXT",
      "scope": "privacy, purpose, authority and minimization review",
      "problem": "technical observability alone cannot establish lawful basis, purpose limitation, retention or recipient legitimacy",
      "objective": "bind factual data flow to jurisdiction, role, purpose, minimization, retention and authority without issuing a legal conclusion beyond evidence",
      "risk_vector": {"A":"P1","S":"WATCH","P":"P1","G":"P1","I":"WATCH","V":"CONTROLLED","C":"WATCH","U":"P1"},
      "provenance": ["docs/legal/GLOBAL_DATA_PRIVACY_GNSS_AI_GOVERNANCE_V1.md","data/normative-graph/GLOBAL_DATA_PRIVACY_GNSS_AI_SEMANTIC_ATLAS_V1.json","indices/MATRIZ_CONFORMIDADE.md"],
      "required_evidence": ["jurisdiction facts","controller/processor/service role facts when applicable","declared purpose","field necessity assessment","retention path","recipient path","authority/base field or TOKEN_VAZIO"],
      "falsifier": "a data field is retained/transferred without a mapped purpose/authority or is broader than necessary for the declared test",
      "closure_condition": "data-flow review is complete enough to state a bounded governance result while unresolved legal questions remain explicitly REVIEW_REQUIRED/TOKEN_VAZIO",
      "mitigations": ["data minimization","purpose limitation","retention minimization","least privilege","separate legal review from engineering PASS"],
      "forbidden_promotions": ["technical PASS != legal compliance","consent toggle != complete lawful-basis analysis","privacy policy text != runtime proof"],
      "dependencies": ["FN-GNSS-004"],
      "claim_target": "BOUNDED_CLAIM",
      "next_on_pass": "FN-GNSS-006",
      "next_on_fail": "FN-GNSS-005"
    },
    {
      "id": "FN-GNSS-006",
      "order": 6,
      "state": "TOKEN_VAZIO",
      "priority": "P1",
      "urgency": "SCHEDULED",
      "scope": "reproducibility and temporal drift",
      "problem": "one successful observation may be transient or device/build specific",
      "objective": "repeat the minimum test under pinned context and compare only compatible observations",
      "risk_vector": {"A":"CONTROLLED","S":"WATCH","P":"WATCH","G":"WATCH","I":"P1","V":"WATCH","C":"CONTROLLED","U":"P1"},
      "provenance": ["data/control-plane/legal-gnss/F_NEXT_CONTINUOUS_EVOLUTION_20260826.v1.json"],
      "required_evidence": ["second receipt","same-context or explicitly changed-context record","diff of observed fields","drift explanation or TOKEN_VAZIO"],